<!ELEMENT jornada (denominacion, imagen, categoria, partido+)>
<!ATTLIST jornada numero CDATA #REQUIRED>
<!ELEMENT denominacion (#PCDATA)>
<!ELEMENT imagen (#PCDATA)>
<!ELEMENT categoria (#PCDATA)>
<!ELEMENT partido (local, visitante, goleslocal, golesvistante)>
<!ATTLIST partido fecha CDATA #REQUIRED>
<!ATTLIST partido hora CDATA #REQUIRED>
<!ELEMENT local (#PCDATA)>
<!ATTLIST local escudo CDATA #REQUIRED>
<!ELEMENT visitante (#PCDATA)>
<!ATTLIST visitante escudo CDATA #REQUIRED>
<!ELEMENT goleslocal (#PCDATA)>
<!ELEMENT golesvistante (#PCDATA)>