<?xml version="1.0" encoding="UTF-8"?>
<?xml-stylesheet href="style.xsl" type="text/xsl"?>
<!DOCTYPE jornada SYSTEM "jornada.dtd">
<jornada numero="32">
    <denominacion>Liga Santander</denominacion>
    <imagen>https://logodownload.org/wp-content/uploads/2018/05/laliga-logo-1.png</imagen>
    <categoria>1ª División</categoria>
    <partido fecha="15 Abril" hora="21:00">
        <local escudo="188">R. Sociedad</local>
        <visitante escudo="185">Betis</visitante>
        <goleslocal>0</goleslocal>
        <golesvistante>0</golesvistante>
    </partido>
    <partido fecha="16 Abril" hora="14:00">
        <local escudo="954">Elche</local>
        <visitante escudo="181">Mallorca</visitante>
        <goleslocal>3</goleslocal>
        <golesvistante>0</golesvistante>
    </partido>
    <partido fecha="16 Abril" hora="16:15">
        <local escudo="173">Alaves</local>
        <visitante escudo="184">Rayo</visitante>
        <goleslocal>1</goleslocal>
        <golesvistante>0</golesvistante>
    </partido>
    <partido fecha="16 Abril" hora="18:30">
        <local escudo="191">Valencia</local>
        <visitante escudo="450">Osasuna</visitante>
        <goleslocal>1</goleslocal>
        <golesvistante>2</golesvistante>
    </partido>
    <partido fecha="16 Abril" hora="21:00">
        <local escudo="1450">Getafe</local>
        <visitante escudo="449">Villarreal</visitante>
        <goleslocal>1</goleslocal>
        <golesvistante>2</golesvistante>
    </partido>
    <partido fecha="17 Abril" hora="14:00">
        <local escudo="5683">Granada</local>
        <visitante escudo="855">Levante</visitante>
        <goleslocal>1</goleslocal>
        <golesvistante>4</golesvistante>
    </partido>
    <partido fecha="17 Abril" hora="16:15">
        <local escudo="175">Atlético</local>
        <visitante escudo="177">Español</visitante>
        <goleslocal>2</goleslocal>
        <golesvistante>1</golesvistante>
    </partido>
    <partido fecha="17 Abril" hora="18:30">
        <local escudo="174">Athletic</local>
        <visitante escudo="176">Celta</visitante>
        <goleslocal>0</goleslocal>
        <golesvistante>2</golesvistante>
    </partido>
    <partido fecha="17 Abril" hora="21:00">
        <local escudo="179">Sevilla</local>
        <visitante escudo="186">R. Madrid</visitante>
        <goleslocal>2</goleslocal>
        <golesvistante>3</golesvistante>
    </partido>
    <partido fecha="18 Abril" hora="21:00">
        <local escudo="178">Barcelona</local>
        <visitante escudo="1737">Cádiz</visitante>
        <goleslocal>0</goleslocal> 
        <golesvistante>1</golesvistante>
    </partido>
</jornada>